{
  "$schema": "https://json-schema.org/draft/2020-12/schema",
  "title": "Mtek context export",
  "description": "The document `mtek context` prints (spec/ai-and-benchmarks.md section 2, decisions 0072 and 0110). contextFormat 2 (decision 0110: field lines instead of field objects, schemaGuide, reference). Keys are never added without a new contextFormat, so unknown keys are errors.",
  "type": "object",
  "additionalProperties": false,
  "required": [
    "languageVersion",
    "compilerVersion",
    "contextFormat",
    "supported",
    "syntax",
    "project",
    "symbols",
    "schemaGuide",
    "schemas",
    "examples",
    "diagnosticsGuide"
  ],
  "properties": {
    "languageVersion": {
      "description": "The language version this compiler build implements.",
      "const": "0.1"
    },
    "compilerVersion": {
      "description": "The version of the compiler build that produced the document.",
      "type": "string",
      "minLength": 1
    },
    "contextFormat": {
      "description": "The version of this format.",
      "const": 2
    },
    "supported": {
      "type": "object",
      "additionalProperties": false,
      "required": ["features", "notSupported"],
      "properties": {
        "features": {
          "description": "What this build implements: language constructs by name, then library items as kind:name. Derived from the build, never written by hand.",
          "type": "array",
          "items": { "type": "string", "minLength": 1 },
          "uniqueItems": true
        },
        "notSupported": {
          "description": "What this build rejects: planned features as 'name (planned for Mn)', reserved words, and what v0.1 never accepts.",
          "type": "array",
          "items": { "type": "string", "minLength": 1 },
          "uniqueItems": true
        }
      }
    },
    "syntax": {
      "type": "object",
      "additionalProperties": false,
      "required": ["keywords", "precedence", "rules"],
      "properties": {
        "keywords": {
          "type": "array",
          "items": { "type": "string", "minLength": 1 },
          "uniqueItems": true
        },
        "precedence": {
          "description": "Operator levels, tightest first.",
          "type": "array",
          "items": { "type": "string", "minLength": 1 }
        },
        "rules": {
          "type": "array",
          "items": { "type": "string", "minLength": 1 }
        }
      }
    },
    "project": {
      "type": "object",
      "additionalProperties": false,
      "required": ["entry", "scene", "modules"],
      "properties": {
        "entry": {
          "description": "The entry module, relative to the project root.",
          "type": "string",
          "minLength": 1
        },
        "scene": {
          "description": "The entry scene; null if the project selects none.",
          "type": ["string", "null"]
        },
        "modules": {
          "description": "Every module of the project in load order, relative to the project root.",
          "type": "array",
          "items": { "type": "string", "minLength": 1 },
          "minItems": 1
        }
      }
    },
    "symbols": {
      "description": "The requested declarations (or the entry scene's), what is nested in them, and the declarations one reference away; in module load order and source order.",
      "type": "array",
      "items": { "$ref": "#/$defs/symbol" }
    },
    "schemaGuide": {
      "description": "How to read the field lines of schemas.",
      "type": "string",
      "minLength": 1
    },
    "schemas": {
      "description": "The registry schemas the requested declarations use, sorted by name, with the fields this build implements. For a cold-start project (no entity, prefab, material, function, constant or struct) every implemented schema that has fields, with the documentation and range of its fields.",
      "type": "array",
      "items": { "$ref": "#/$defs/schema" }
    },
    "reference": {
      "description": "Present only for a cold-start project: the built-in library, generated from the registry. Each key is a section that --max-bytes can drop whole (lowest priority first: records, body, events, builtins with typeClasses, conventions, enums).",
      "type": "object",
      "additionalProperties": false,
      "minProperties": 1,
      "properties": {
        "enums": {
          "description": "Built-in enums with every member.",
          "type": "array",
          "items": { "$ref": "#/$defs/enum" },
          "minItems": 1
        },
        "typeClasses": {
          "description": "What the type classes T, I and V stand for in builtins.",
          "type": "array",
          "items": { "type": "string", "minLength": 1 },
          "minItems": 1
        },
        "builtins": {
          "description": "Signatures of the built-in functions, namespace members and accessors; the registry's documentation follows ' // ' where a signature does not say enough.",
          "type": "array",
          "items": { "type": "string", "minLength": 1 },
          "minItems": 1
        },
        "events": {
          "description": "The events a handler can subscribe to.",
          "type": "array",
          "items": { "type": "string", "minLength": 1 },
          "minItems": 1
        },
        "records": {
          "description": "Built-in record types and their fields.",
          "type": "array",
          "items": { "type": "string", "minLength": 1 },
          "minItems": 1
        },
        "body": {
          "description": "Body commands and readable body properties.",
          "type": "array",
          "items": { "type": "string", "minLength": 1 },
          "minItems": 1
        },
        "conventions": {
          "description": "Cross-cutting rules (colour spaces, time), quoted from the registry's documentation.",
          "type": "array",
          "items": { "$ref": "#/$defs/convention" },
          "minItems": 1
        }
      }
    },
    "examples": {
      "description": "Complete programs that mtek check accepts, most relevant first.",
      "type": "array",
      "items": { "$ref": "#/$defs/example" }
    },
    "diagnosticsGuide": {
      "type": "string",
      "minLength": 1
    },
    "truncated": {
      "description": "Present only when --max-bytes made the export leave something out: per section how many items were dropped and the names of the first few, lowest priority first.",
      "type": "object",
      "additionalProperties": false,
      "minProperties": 1,
      "properties": {
        "examples": { "$ref": "#/$defs/dropped" },
        "neighbours": { "$ref": "#/$defs/dropped" },
        "reference": { "$ref": "#/$defs/dropped" },
        "schemas": { "$ref": "#/$defs/dropped" },
        "symbols": { "$ref": "#/$defs/dropped" }
      }
    }
  },
  "$defs": {
    "dropped": {
      "type": "object",
      "additionalProperties": false,
      "required": ["count", "names"],
      "properties": {
        "count": {
          "description": "How many items were left out.",
          "type": "integer",
          "minimum": 1
        },
        "names": {
          "description": "The names of the first (at most 16) items left out, lowest priority first.",
          "type": "array",
          "items": { "type": "string" },
          "minItems": 1,
          "maxItems": 16
        }
      }
    },
    "symbol": {
      "type": "object",
      "additionalProperties": false,
      "required": ["name", "kind", "type", "doc", "file", "line"],
      "properties": {
        "name": {
          "description": "The declaration names from the module item down, joined by '.'.",
          "type": "string",
          "minLength": 1
        },
        "kind": {
          "description": "scene, entity, prefab, material, struct, fn, cpu_fn, const, state, param, or the keyword of a scene object (camera).",
          "type": "string",
          "minLength": 1
        },
        "type": {
          "description": "The type as written, or a short description for a declaration without one.",
          "type": "string"
        },
        "doc": {
          "description": "The documentation comment, '///' lines joined by a line feed; empty if none.",
          "type": "string"
        },
        "file": { "type": "string", "minLength": 1 },
        "line": { "description": "1-based.", "type": "integer", "minimum": 1 }
      }
    },
    "schema": {
      "type": "object",
      "additionalProperties": false,
      "required": ["name", "fields"],
      "properties": {
        "name": { "type": "string", "minLength": 1 },
        "doc": {
          "description": "The registry documentation of the schema; only for a cold-start project.",
          "type": "string",
          "minLength": 1
        },
        "fields": { "type": "array", "items": { "$ref": "#/$defs/field" } }
      }
    },
    "field": {
      "description": "One field: `name: type`, then ` = default` (canonical source text) when it has one, ` [flags]` when it has any (some of R required, W writable from handlers, B bindable, C construction-only, in that order), and for a cold-start project ` range R` when the range says more than 'greater than zero' and ` // meaning` (the registry documentation).",
      "type": "string",
      "pattern": "^[a-z][a-z0-9_]*: [^ ]+( = [^ ].*?)?( \\[R?W?B?C?\\])?( range [^ ].*?)?( // .+)?$"
    },
    "enum": {
      "type": "object",
      "additionalProperties": false,
      "required": ["name", "doc", "members"],
      "properties": {
        "name": { "type": "string", "minLength": 1 },
        "doc": { "type": "string", "minLength": 1 },
        "members": {
          "description": "Every member this build implements, as written after the enum's name and a point, separated by one space.",
          "type": "string",
          "minLength": 1
        }
      }
    },
    "convention": {
      "type": "object",
      "additionalProperties": false,
      "required": ["topic", "notes"],
      "properties": {
        "topic": { "type": "string", "minLength": 1 },
        "notes": {
          "description": "`item: documentation`, one per registry item the convention concerns.",
          "type": "array",
          "items": { "type": "string", "minLength": 1 },
          "minItems": 1
        }
      }
    },
    "example": {
      "type": "object",
      "additionalProperties": false,
      "required": ["title", "source"],
      "properties": {
        "title": { "type": "string", "minLength": 1 },
        "source": {
          "description": "A complete entry module.",
          "type": "string",
          "minLength": 1
        }
      }
    }
  }
}
