{
 "languageVersion": "0.1",
 "compilerVersion": "0.1.0-dev",
 "contextFormat": 2,
 "supported": {"features":["imports","exports","constants","body-constants","functions","cpu-functions","structs","enums","materials","compute-programs","prefabs","scenes","scene-fields","state","scene-objects","entities","entity-fields","prefab-instances","lifecycle-functions","handlers","bind","self","descriptors","strings","arrays","indexing","negation","arithmetic","remainder","comparison","equality","logical","match","body-command:apply_force","body-command:apply_impulse","body-command:move_character","body-command:set_kinematic_target","body-command:set_linear_velocity","body-command:teleport","body-property:angular_velocity","body-property:ground_normal","body-property:grounded","body-property:linear_velocity","enum:Key","event:collision_enter","event:collision_exit","event:key_down","event:key_up","event:message","event:pointer_down","event:pointer_move","event:pointer_up","function:abs","function:acos","function:alive","function:animation.copy_pose","function:animation.crossed","function:animation.duration","function:animation.fade","function:animation.finished","function:animation.joint_position","function:animation.joint_rotation","function:animation.pause","function:animation.play","function:animation.playing","function:animation.resume","function:animation.seek","function:animation.time","function:animation.transition","function:animation.weight","function:asin","function:asset.font","function:asset.glb","function:asset.linear_texture","function:asset.sound","function:asset.texture","function:atan","function:atan2","function:ceil","function:chance","function:choose","function:clamp","function:clear_saved","function:color.linear","function:color.srgb","function:cos","function:count_tagged","function:cross","function:degrees","function:destroy","function:destroy_tagged","function:distance","function:dot","function:easing.in_cubic","function:easing.in_out_cubic","function:easing.in_out_quad","function:easing.in_out_sine","function:easing.in_quad","function:easing.out_back","function:easing.out_bounce","function:easing.out_cubic","function:easing.out_elastic","function:easing.out_quad","function:exp","function:exp2","function:first_tagged","function:floor","function:fract","function:gamepad.axis","function:gamepad.button","function:gamepad.connected","function:go_to","function:has_tag","function:hud.button","function:hud.pixel_font","function:hud.rect","function:hud.text","function:inverse_sqrt","function:is_key_down","function:is_muted","function:is_pointer_down","function:key_pressed","function:key_released","function:length","function:lighting.pbr","function:lighting.pbr_mapped","function:load","function:log","function:log2","function:mat4.columns","function:mat4.identity","function:mat4.rotation","function:mat4.scale","function:mat4.translation","function:max","function:min","function:mix","function:nearest_tagged","function:normalize","function:overlap_boxes","function:overlap_spheres","function:particle_count","function:pause","function:paused","function:play","function:play_at","function:play_music","function:pointer_position","function:pow","function:print","function:quat.axis_angle","function:quat.euler","function:quat.identity","function:radians","function:random","function:random_int","function:random_range","function:reflect","function:reset","function:resume","function:round","function:sample","function:sample_mip","function:sampler.linear_clamp","function:sampler.linear_clamp_level0","function:sampler.linear_clamp_mip_nearest","function:sampler.linear_repeat","function:sampler.linear_repeat_level0","function:sampler.linear_repeat_mip_nearest","function:sampler.nearest_clamp","function:sampler.nearest_clamp_level0","function:sampler.nearest_clamp_mip_linear","function:sampler.nearest_repeat","function:sampler.nearest_repeat_level0","function:sampler.nearest_repeat_mip_linear","function:saturate","function:save","function:screen_to_world","function:send","function:set_camera","function:set_muted","function:set_volume","function:shuffle","function:sign","function:sin","function:smoothstep","function:spawn","function:sqrt","function:step","function:stop_music","function:tagged","function:tan","function:texture.black","function:texture.white","function:transpose","function:trunc","function:world_to_screen","method:glb_asset.material","method:glb_asset.material_base_color","method:glb_asset.material_metallic","method:glb_asset.material_roughness","method:glb_asset.material_texture","method:glb_asset.mesh","method:glb_asset.node_position","method:glb_asset.node_rotation","method:glb_asset.node_scale","method:glb_asset.primitive","namespace:animation","namespace:asset","namespace:color","namespace:easing","namespace:frame","namespace:gamepad","namespace:hud","namespace:lighting","namespace:mat4","namespace:quat","namespace:sampler","namespace:texture","scene-object:camera","schema:Box","schema:BoxCollider","schema:Camera","schema:CapsuleCollider","schema:DirectionalLight","schema:Dynamic","schema:Emitter","schema:Entity","schema:Kinematic","schema:Orthographic","schema:Pbr","schema:Perspective","schema:Plane","schema:PointLight","schema:Scene","schema:Sphere","schema:SphereCollider","schema:Sprite","schema:Static","schema:Unlit","type:ComputeInput","type:PointerEvent","type:SurfaceInput","type:VertexInput","type:array","type:bool","type:color","type:entity_ref","type:f32","type:font","type:glb_asset","type:i32","type:mat4","type:material","type:mesh","type:quat","type:sampler","type:sound","type:string","type:texture","type:u32","type:vec2","type:vec3","type:vec4","value:frame.delta","value:frame.index","value:frame.time"],"notSupported":["non-constant-initial-values","as","async","await","extern","impl","loop","mod","move","mut","priv","pub","static","super","trait","type","unsafe","use","where","yield","compute","vertex","storage","uniform","workgroup","system","query","component","bitwise operators (& | ^ ~ << >>)","material-local compute stages","remote assets (URLs as asset paths)","instancing a whole node hierarchy of a glTF asset"]},
 "syntax": {
  "keywords": [
   "bind",
   "break",
   "const",
   "continue",
   "cpu",
   "else",
   "entity",
   "enum",
   "export",
   "false",
   "fn",
   "for",
   "if",
   "import",
   "in",
   "let",
   "match",
   "material",
   "on",
   "param",
   "prefab",
   "return",
   "scene",
   "self",
   "state",
   "struct",
   "true",
   "var",
   "while"
  ],
  "precedence": [
   "level 8: call f(...), field .x, index [i] (left)",
   "level 7: unary - ! (right)",
   "level 6: * / % (left)",
   "level 5: + - (left)",
   "level 4: < <= > >= (non-associative)",
   "level 3: == != (non-associative)",
   "level 2: && (left)",
   "level 1: || (left)"
  ],
  "rules": [
   "Declarations/fields/assignments/statements need ';', before '}' too.",
   "Floats 1.0,0.5,2.5e-3: digits around '.'; integers unsigned decimal, no leading zeros.",
   "Colours: #RRGGBB or #RRGGBBAA.",
   "< <= > >= == != do not chain; use (a < b) && (b < c).",
   "No implicit conversions; literals take expected numeric types.",
   "import {Name} from \"./path.mtek\"; paths: ./ or ../, .mtek suffix.",
   "Scene camera: camera Main {}.",
   "Fields/params must be declared.",
   "compute P { param gain:f32=2.0; input src:array<T,N>; output dst:array<T,N>; kernel(i:ComputeInput)->T{return src[i.index];} } Host: app.createCompute. Fixed N; <=4 inputs, 1 output."
  ]
 },
 "project": {
  "entry": "src/main.mtek",
  "scene": "Demo",
  "modules": [
   "src/main.mtek"
  ]
 },
 "symbols": [
  {
   "name": "pulse",
   "kind": "fn",
   "type": "(t: f32) -> f32",
   "doc": "",
   "file": "src/main.mtek",
   "line": 1
  },
  {
   "name": "Pulse",
   "kind": "material",
   "type": "material",
   "doc": "",
   "file": "src/main.mtek",
   "line": 5
  },
  {
   "name": "Pulse.tint",
   "kind": "param",
   "type": "color",
   "doc": "",
   "file": "src/main.mtek",
   "line": 6
  },
  {
   "name": "Pulse.phase",
   "kind": "param",
   "type": "f32",
   "doc": "",
   "file": "src/main.mtek",
   "line": 7
  },
  {
   "name": "Demo.speed",
   "kind": "state",
   "type": "f32",
   "doc": "",
   "file": "src/main.mtek",
   "line": 15
  },
  {
   "name": "Demo.tint",
   "kind": "state",
   "type": "color",
   "doc": "",
   "file": "src/main.mtek",
   "line": 16
  },
  {
   "name": "Demo.Cube",
   "kind": "entity",
   "type": "entity",
   "doc": "",
   "file": "src/main.mtek",
   "line": 23
  }
 ],
 "schemaGuide": "A field line reads `name: type = default [flags]`; R required, W writable, B bindable, C construction-only.",
 "schemas": [
  {
   "name": "Box",
   "fields": [
    "size: vec3 = vec3(1.0, 1.0, 1.0) [C]"
   ]
  },
  {
   "name": "Entity",
   "fields": [
    "position: vec3 = vec3(0.0, 0.0, 0.0) [WB]",
    "rotation: quat = quat.identity() [WB]",
    "scale: vec3 = vec3(1.0, 1.0, 1.0) [WB]",
    "visible: bool = true [WB]",
    "bounds_center: vec3 = vec3(0.0, 0.0, 0.0) [WB]",
    "bounds_radius: f32 = 0.0 [WB]",
    "mesh: mesh [C]",
    "material: material = Unlit {} [W]",
    "light: light [C]",
    "body: body [C]",
    "collider: collider [C]",
    "tag: string [C]",
    "particles: emitter [C]",
    "clip: string [C]"
   ]
  }
 ],
 "examples": [
  {
   "title": "A material with a fragment stage",
   "source": "// A material's `fragment` runs per pixel on the GPU; the `fn` helpers it calls must be GPU-safe.\nfn pulse(t: f32) -> f32 {\n    return 0.65 + 0.35 * sin(t);\n}\n\nmaterial Pulse {\n    param tint: color = #6b5cff;\n    param phase: f32 = 0.0;\n\n    fragment(input: SurfaceInput) -> color {\n        return color.linear(tint.rgb * pulse(phase), tint.a);\n    }\n}\n\nscene Demo {\n    camera Main {\n        position: vec3(0.0, 2.0, 5.0);\n        target: vec3(0.0, 0.5, 0.0);\n    }\n\n    entity Cube {\n        mesh: Box {};\n        material: Pulse { phase: bind(frame.time); };\n    }\n}\n"
  },
  {